video_url,author,text,time,votes
https://www.youtube.com/watch?v=YvvPeimqLQI,@luzmarinapimiento6668,Paso el.tiempo y juan diego.segun se retiro ya  de caracol,hace 2 años,1
https://www.youtube.com/watch?v=YvvPeimqLQI,@mariojr5211,El día D un antes y un después del periodista Juan Diego Alvira. El poder!!,hace 2 años,1
https://www.youtube.com/watch?v=YvvPeimqLQI,@Mathrobert,"Hoy veo esta entrevista y sí, efectivamente lo botaron.",hace 2 años,4
https://www.youtube.com/watch?v=YvvPeimqLQI,@hernanandica5700,Vengo del futuro lo hicieron aburrir para q se fuera 😢😢,hace 2 años,3
https://www.youtube.com/watch?v=YvvPeimqLQI,@adolfoospina3804,No duró mucho después de esto😢😢,hace 2 años,2
https://www.youtube.com/watch?v=YvvPeimqLQI,@carlosrodriguez-eh4ld,Y lo sacaron....,hace 2 años,1
https://www.youtube.com/watch?v=YvvPeimqLQI,@josegarzon6167,Así hicieran con todos los corruptos pero eso no es con todos,hace 4 años,2
https://www.youtube.com/watch?v=YvvPeimqLQI,@josealvaroabrildulcey2155,Periodistas como Juan Diego son los que necesita Colombia. Asi es como se deben enfrentar esas ratas que tanto daño y por tanto tiempo le han causado al pais.,hace 4 años,0
https://www.youtube.com/watch?v=YvvPeimqLQI,@bufalobill9896,🤪,hace 4 años,0
https://www.youtube.com/watch?v=YvvPeimqLQI,@bufalobill9896,Más ficticia que una moneda de cuero!🧐,hace 4 años,1
https://www.youtube.com/watch?v=YvvPeimqLQI,@juanbeleno6193,"La ministra a Juan Diego después de la entrevista.... ""Le voy a dar en la Cara Mar%¢a"" JAJAJAJAJA",hace 4 años,4
https://www.youtube.com/watch?v=YvvPeimqLQI,@MLOPJK,De q me hablas viejo,hace 4 años,0
https://www.youtube.com/watch?v=YvvPeimqLQI,@mariaelsavirguez7541,Dios permite que no porque por éso le puede causar problemas para el porque hablar la verda es un delito y la corrupción es un honor,hace 4 años,17
https://www.youtube.com/watch?v=YvvPeimqLQI,@mauricioparra2939,Eso sí destapó la olla podrida Juan diego alvira dejó a esa ministra como un zapato frente a todos los colombianos y en televisión universal,hace 4 años,12
https://www.youtube.com/watch?v=YvvPeimqLQI,@camiloxrq6346,"No lo van a hacer
A los de caracol lo que mas les importa es el rating",hace 4 años (editado),8
https://www.youtube.com/watch?v=YvvPeimqLQI,@DJESCOBARR,"que lo echen de caracol es lo de menos, lo importante que se cuide la espalda porque muchos terminan mal por destapar y contar la verdad y la realidad en la que esta el pais",hace 4 años,5
https://www.youtube.com/watch?v=YvvPeimqLQI,@mariaelsavirguez7541,Si éso es verdad estamos muy mal como estamos en un gobierno de corruptos y que nadie puede decir nada porque lo mandan a callar o le toca salir del país sólo por el poder y la ambición de Tener más,hace 4 años,2
https://www.youtube.com/watch?v=YvvPeimqLQI,@nestorclavijo7648,De pronto si lo sacan  × el dueño del canal = farcsantos.,hace 4 años,1
https://www.youtube.com/watch?v=YvvPeimqLQI,@lucerolamprea3550,😢,hace 4 años,0
https://www.youtube.com/watch?v=YvvPeimqLQI,@elizabethmarinaalvarezlobo9346,Buen recordéis para la ministra. Juan Diego la sacaste del estadio con pruebas y todo 👏👏👏,hace 4 años,0
https://www.youtube.com/watch?v=YvvPeimqLQI,@oisabel.hurtado,"Pues si lo echan de Caracol, él es un buen profesional. En otro lado seguirá haciendo historia.",hace 4 años,2
https://www.youtube.com/watch?v=YvvPeimqLQI,@lordbrayantv, @camiloxrq6346  rating*,hace 4 años,0
https://www.youtube.com/watch?v=YvvPeimqLQI,@lordbrayantv,Nadie va a echar a nadie. Todas las noticias son previamente revisadas y autorizadas. Esto fue lo mejor que he visto 👏👏👏,hace 4 años,0
https://www.youtube.com/watch?v=YvvPeimqLQI,@camiloxrq6346," @lordbrayantv  ohhhhh hasta ahora me di cuenta jajaja
Gracias",hace 4 años,0
https://www.youtube.com/watch?v=YvvPeimqLQI,@perhapsperhaps7373,🤤🤤🤤🤤🤤🤤🤤,hace 4 años,1
https://www.youtube.com/watch?v=YvvPeimqLQI,@pipebrs3467, @perhapsperhaps7373  ??,hace 4 años,1
https://www.youtube.com/watch?v=YvvPeimqLQI,@nemqueteba3139,"""70.000.000 millones""?
¿Sabe usted cuánto es eso?",hace 4 años,2
https://www.youtube.com/watch?v=YvvPeimqLQI,@carlosandresvalensiafiguer7086,Ya selo repartió entre Uribismo,hace 3 años,2
https://www.youtube.com/watch?v=YvvPeimqLQI,@Camilo852ZloRap,jajajaja te faltaron 3 ceros son 70.000.000.000.,hace 3 años,1
https://www.youtube.com/watch?v=YvvPeimqLQI,@sandraelvirabustosforero1898,Con tantas pruebas porque sigue libre? Pero fuera uno de pie limpio y todo el rigor de la ley🤨,hace 3 años,1
https://www.youtube.com/watch?v=YvvPeimqLQI,@rolindeines4547,Para mí parecer no cumplió gracias Juan Diego un exelente periodista mi Dios lo guarde,hace 3 años,0
https://www.youtube.com/watch?v=YvvPeimqLQI,@eugeniaceballos3183,Mefacina Juan Diego Alvira yAlejanqra jiralqo buenos periodistasDioslos bendiga,hace 3 años,0
https://www.youtube.com/watch?v=YvvPeimqLQI,@ednaluzmosqueramoreno8716,Jajajaja siiiiii,hace 3 años,1
https://www.youtube.com/watch?v=YvvPeimqLQI,@insightmars1248,Son 70.000.000.000,hace 3 años,1
https://www.youtube.com/watch?v=YvvPeimqLQI,@luiscarlosrueda,Ella no tuvo nada que ver,hace 3 años,0
https://www.youtube.com/watch?v=YvvPeimqLQI,@teresaceron5684,Boy a seguir robándole,hace 4 años,6
https://www.youtube.com/watch?v=YvvPeimqLQI,@carmencecilianavarrodearen3935,"Es una mapana peligrosa,  Dios nos libre",hace 4 años,9
https://www.youtube.com/watch?v=YvvPeimqLQI,@carmencecilianavarrodearen3935," @angelaheredia173  ellos destacaron la olla  podrida y la mapana peligrosa dice que ella fue la que descubrió, pero regaño por dejar filtrar la información ℹ que investiguen a quienes sacaron de los cargos y no tenían nada que ver",hace 4 años,3
https://www.youtube.com/watch?v=YvvPeimqLQI,@edwinyesidcoronelcorrea697,Por parte de ellos ni se supiera.,hace 4 años,1
https://www.youtube.com/watch?v=YvvPeimqLQI,@jaimealbertogonzalez4250,"No + de la misma mierda de siempre, pero la Contraloría, Fiscalía y Procuraduría generales de la Nación, ponerle mucho énfasis y enfoque en combatir el flagelo continuo de la corrupción, para el bien de la gente común y corriente y no corrompa más la sal de los colombianos, pero todo tiene su final
Así, decía una canción.",hace 4 años,1
https://www.youtube.com/watch?v=YvvPeimqLQI,@angelpotter2266,O se va o se va!!,hace 4 años,2
https://www.youtube.com/watch?v=YvvPeimqLQI,@andrespedroso8131,Puro blablabla esta ministra,hace 4 años,0
https://www.youtube.com/watch?v=YvvPeimqLQI,@mirianmarin5575,"Es que para ella cómo han robado el anta, $700mil millones son como $1000",hace 4 años,5
https://www.youtube.com/watch?v=YvvPeimqLQI,@anycar7769,"Que descaro el de esta señora .cree que se perdieron 3 pesos .
Que renuncie , está demorada",hace 4 años,0
https://www.youtube.com/watch?v=YvvPeimqLQI,@oscared9251,Lo más triste hermano es que nadie se indigna con este tipo de personas. Pero au sí se trataba de los políticos contrario a sus gustos ideológicos.,hace 1 año,0
https://www.youtube.com/watch?v=YvvPeimqLQI,@pepeperez8910,Esa gente no tiene honor,hace 4 años,9
https://www.youtube.com/watch?v=YvvPeimqLQI,@cristiandavidmartinenezdel2172,"Nosotros también deberíamos entender algo, el único que dijo sea luz y no hubo inconvenientes fue Dios porque  esa es la única boca que cuando habla hasta el diablo tiene que decir amen(que así sea y punto) pero las palabras de un mortal pueden ser ignorancias, y el que no lo vea así es porque se cree Dios. De mi parte deseo que a esa señora le vaya bien y que Dios la ayude a sacar a adelante un mejor resultado de lo que un día dijo.",hace 4 años,0
https://www.youtube.com/watch?v=YvvPeimqLQI,@luisc945," @cristiandavidmartinenezdel2172  Ud es la que no teme a Dios por meterlo en algo que la religión nada tiene que ver. Esa mujer no hizo su trabajo que era verificar el avance de ese contrato, se dio cuenta de su falla cuando otros lo descubrieron, eso quiere decir que ella no es buena funcionaria y por tanto debería renunciar. Si hubiese hecho su trabajo a los dos meses se hubiese dado cuenta del atraso.",hace 4 años,4
https://www.youtube.com/watch?v=YvvPeimqLQI,@cristiandavidmartinenezdel2172," @luisc945  A Dios no hay que meterlo en los asuntos políticos porque el ya vive dentro de ellos, él ha estado desde el principio de la historia adentro solo que algunos ojos no lo quieren ver y les parece que esta afuera y hay que darle permisos para que entre.  Dios no es religión, él es relación, y tiene mucho que ver con esto aunque no lo puedas creer. Y jamás existirá un super héroe que hable y su palabra sea inquebrantable.",hace 4 años,1
https://www.youtube.com/watch?v=YvvPeimqLQI,@ricardomususuacevedo3110,De país con gente así de tramposa,hace 4 años,1
https://www.youtube.com/watch?v=YvvPeimqLQI,@ricardomususuacevedo3110,Nunciar más bien debería ella misma entregarse que asco,hace 4 años,1
https://www.youtube.com/watch?v=YvvPeimqLQI,@Yeico_Fx," @cristiandavidmartinenezdel2172  Dios no nos abandonó porque Dios no se mete en las vainas políticas, admitelo esa ministra es una incompetente dejen de meter a Dios en todo",hace 4 años,1
https://www.youtube.com/watch?v=YvvPeimqLQI,@jairofraile7354, @cristiandavidmartinenezdel2172  :~ Del robo en cuestión a usted que porcentaje le dieron.,hace 3 años,0
https://www.youtube.com/watch?v=YvvPeimqLQI,@frankstevenrojascruz8098,"Imagínese ,que pocas posibilidades hay para hacer cosas con un presupuesto de $70.000.0000 jajajaj",hace 3 años,0
https://www.youtube.com/watch?v=YvvPeimqLQI,@julianaospina5847,Alvira jajajaja,hace 4 años,22
https://www.youtube.com/watch?v=YvvPeimqLQI,@DAVID-ql1vo,Escribes tan mal que me sale la opción de traducción xD,hace 4 años,16
https://www.youtube.com/watch?v=YvvPeimqLQI,@protohumano, @DAVID-ql1vo  jajajajaj ce mamo,hace 4 años,2
https://www.youtube.com/watch?v=YvvPeimqLQI,@stellagalvis3304,Juan Diego Alvira.,hace 4 años,2
https://www.youtube.com/watch?v=YvvPeimqLQI,@julianramirez8678,"""Anival"" jajajajajaja de los magníficos jajaauja",hace 4 años,3
https://www.youtube.com/watch?v=YvvPeimqLQI,@francoorozcomunoz8879,Ja ja ja ja Alvira.,hace 4 años,0
https://www.youtube.com/watch?v=YvvPeimqLQI,@emilianodon155,"Jajajaja siii HANNIBAL,porqué se le tragó integra.",hace 4 años,3
https://www.youtube.com/watch?v=YvvPeimqLQI,@mao2se,"Me hizo reír su dislexia, haha buen día.",hace 4 años,0
https://www.youtube.com/watch?v=YvvPeimqLQI,@mao2se," Edwin Estremor  si es mala ortografía, si no tenía idea se dice ""encarar"" 🤡",hace 4 años,0
https://www.youtube.com/watch?v=YvvPeimqLQI,@gdbstudio.4578,"Cual ministra esa deberían de llamarla de otra manera, ya sabemos cual",hace 4 años,0
https://www.youtube.com/watch?v=YvvPeimqLQI,@hellenrivera7353,Jajaajjajjaaa el mejor comentario ..,hace 4 años,1
https://www.youtube.com/watch?v=YvvPeimqLQI,@erichduque667, @protohumano  . ..,hace 4 años,0
https://www.youtube.com/watch?v=YvvPeimqLQI,@Miguelangel-sw7oi, @protohumano  a ud también le aparece en traducir jajaja 😂,hace 3 años,0
https://www.youtube.com/watch?v=YvvPeimqLQI,@jairoalexanderbarrerobrine5402,Cómo se atreve a afirmar que han estado encima de los contratistas cuando la que descubrió esto fue una periodista ..que nivel de descaro al decir q fue engañada,hace 4 años,68
https://www.youtube.com/watch?v=YvvPeimqLQI,@edgar.orlandoruizcepeda4679,Felicitaciones Juan Diego. Así se hace. Y lo hace un buen y excelente periodista. Dios Le Bendiga y Le Le siga e iluminando.,hace 4 años,198
https://www.youtube.com/watch?v=YvvPeimqLQI,@RicardoSanchez-xp7ck,Jajaja no se si comp llegue aca pero esta re bueno.,hace 2 años,0
https://www.youtube.com/watch?v=YvvPeimqLQI,@juanpablovilla8568,"Deberían confrontar igualmente al “presidente Actual”, mostrando todo lo que prometió y antes empeoró todo…",hace 4 años,173
https://www.youtube.com/watch?v=YvvPeimqLQI,@josecaro6720,Es la primera vez que veo a Caracol hacer algo decente en el periodismo.,hace 4 años,442
https://www.youtube.com/watch?v=YvvPeimqLQI,@wago7wg7,"Qué miserables éstos polític@s, no merecen nada bueno.",hace 4 años,154
https://www.youtube.com/watch?v=YvvPeimqLQI,@leninleonojedacompositor6874,"una lapida de mas de $ 70 mil millones, así cualquiera muere tranquilo, juajuajuajua",hace 2 años,1
https://www.youtube.com/watch?v=YvvPeimqLQI,@felipepreciado8319,Me imagino el gran trabajo que Juan Diego Alvira haría en otro medio como Canal Uno,hace 4 años,213
https://www.youtube.com/watch?v=YvvPeimqLQI,@mariaramirezcastro5936,"""Echeverry, me da la impresión de que como que me tumbaron""",hace 4 años,87
https://www.youtube.com/watch?v=YvvPeimqLQI,@jreinel1966,"La mujer es una campeona en defenderse como gato patas arriba,NO CUMPLIO,no hay excusas,se enterro ella misma...!..sweet talker,BS..!..💩💩💩..!",hace 4 años (editado),297
https://www.youtube.com/watch?v=YvvPeimqLQI,@oscarjavierjimenezvelandia4318,Ya un año y  que  paso?  jajaja   ... pues nada  jajjaa ..fuera un vendedor de tomates  si lo condenan.,hace 3 años,4
https://www.youtube.com/watch?v=YvvPeimqLQI,@luiseduardomurillo1208,"Muy bien Juan Diego.
Lo felicito, deben contestar acorde con la pregunta.

Siga esa técnica.
Ser contundente.",hace 4 años,185
https://www.youtube.com/watch?v=YvvPeimqLQI,@nighto_ren9847,"-Sí me dieran moneditas por cada vez que la ministra dice: ""entramado tramposo que nos engaño""... ya tendría buen dinero jaja",hace 4 años,142
https://www.youtube.com/watch?v=YvvPeimqLQI,@hysniangel6230,"Un Gran Concierto para Delinquir y la Directora: La ministra ""Abominable.""",hace 4 años,129
https://www.youtube.com/watch?v=YvvPeimqLQI,@GGM7777,22 de agosto 2023 y la plata no aparece,hace 2 años,1
https://www.youtube.com/watch?v=YvvPeimqLQI,@andrescortezcastro1297,Un crack Juan Diego dios te bendiga y te guarde de esa partida de bandidos... En la cara sin colocarse colorados...,hace 4 años,123
https://www.youtube.com/watch?v=YvvPeimqLQI,@alcidessinisterrahinestroz3519,"Cómo a uno de sus patrones, "" Me Engañaron"" 😂😂😂😂😂😂",hace 4 años,27
https://www.youtube.com/watch?v=YvvPeimqLQI,@jorgenavarronavarro7536,"Los abuelos y mayores nos decían : 《El buen  Periodista es a la Sociedad lo que el Maestro es al Individuo, y el mal Periodista es  a la Sociedad, lo que el Secuestrador es al Individuo》",hace 4 años,79
https://www.youtube.com/watch?v=YvvPeimqLQI,@alexandergarcia7509,Es que con razón como no va hacer torcida si es costeña,hace 1 año,1
https://www.youtube.com/watch?v=YvvPeimqLQI,@paraslash,"Fue a mis espaldas, me acabo de enterar, los soldados me engañaron, etc.

TODOS LOS GOBIERNOS SON IGUALES.",hace 4 años,47
https://www.youtube.com/watch?v=YvvPeimqLQI,@goodfriend7320,"Por esa razón es importante apoyar a la prensa independiente, a Gonzalo Guillén , a María del Pilar Aguilar, Julián Martínez, canales como el de Alejo Vergel, y otros cuentos que se ocupan de esclarecer la verdad",hace 4 años,4
https://www.youtube.com/watch?v=YvvPeimqLQI,@jairofraile7354,Si la engañaron porque no le dieron ni puta mierda de lo pactado.,hace 3 años,0
https://www.youtube.com/watch?v=YvvPeimqLQI,@YoneHaschwalth,"Muy dificil ese y los otros que estan arriba son sus patrones, estos medios estan de parte de ellos y dudo que lo encare sabiendo lo que le podria suceder",hace 4 años,8
https://www.youtube.com/watch?v=YvvPeimqLQI,@alexiavalencia9398,Verdad,hace 4 años,3
https://www.youtube.com/watch?v=YvvPeimqLQI,@maquinasinteligentesitm1679," @YoneHaschwalth  No entiendo eso , acaso la ministra no es elegido por el presidente y es un alto cargo??",hace 4 años,2
https://www.youtube.com/watch?v=YvvPeimqLQI,@YoneHaschwalth, @maquinasinteligentesitm1679  Si pero todos sabemos que este gobierno lo maneja una minoria que tiene otra clase de interes y por eso pasan estas cosas,hace 4 años,2
https://www.youtube.com/watch?v=YvvPeimqLQI,@andreshenao2185,"Si lo hace termina como Vanessa de la Torre, quienes debemos encararlo somos nosotros en las urnas, es hora de sacar del gobierno a estos corruptos al servicio de la elite que es mas corrupta 👌👌👌",hace 4 años,1
https://www.youtube.com/watch?v=YvvPeimqLQI,@fabianvaldesortiz4757,"Esa Ministra debería no estar en Shows de Radio, ni en Noticias Caracol defendiendo lo indefendible, debería estar como dijo ella mismas en el Cementerio de los Políticos OSEA en LA CÁRCEL.. 🤢🤮",hace 3 años,1
https://www.youtube.com/watch?v=YvvPeimqLQI,@SoloArt-ek4qh,Ojalá aparesca esa plata y los colombianos no olviden por qué en unos años está vieja termina siendo presidenta y ahí si apague y vámonos.,hace 4 años,2
https://www.youtube.com/watch?v=YvvPeimqLQI,@angellbautizta4142,Lo raro es que ella misma dijo que ya todo estaba listo con cifras todo como si ya estuviera segura y ahora dice que los engañaron jajajaja si están encima como no se fijaron que la empresa no tenía equipos de nada ni experiencia de nada jajajaja ellos se creen eso solos,hace 4 años,2
https://www.youtube.com/watch?v=YvvPeimqLQI,@carmencecilianavarrodearen3935,Es una mapana peligrosa Dios nos guarde y así todos los políticos,hace 4 años,1
https://www.youtube.com/watch?v=YvvPeimqLQI,@carmencecilianavarrodearen3935,Es una Mapana peligrosa Díos nos guarde y así son todos,hace 4 años,1
https://www.youtube.com/watch?v=YvvPeimqLQI,@luiseduardocamargo5394,Renunciar es muy fácil pero la plata que? Se pierde y ya no Jodan que aparezca la plata y ahí si que se vaya asta para el cementerio,hace 4 años,1
https://www.youtube.com/watch?v=YvvPeimqLQI,@teresarolong1144, @luiseduardocamargo5394  si para el calan cala enseguida ella lo dijo,hace 4 años,0
https://www.youtube.com/watch?v=YvvPeimqLQI,@shirleyllinas3410,"En esa situación, fácilmente puede perder su trabajo...",hace 4 años,11
https://www.youtube.com/watch?v=YvvPeimqLQI,@Hell-mx3tz, @shirleyllinas3410  eso pienso:( no me sorprenderia si lo pierde:'(,hace 4 años,4
https://www.youtube.com/watch?v=YvvPeimqLQI,@saramariacorrea5340,Hay que sacar ala ministra ya que no cumplio cuando uno no cumple en el trabajo chao pescao ..asi de facil ..ministra chao pescao,hace 4 años,4
https://www.youtube.com/watch?v=YvvPeimqLQI,@josleo7552,Jajajaja,hace 4 años,0
https://www.youtube.com/watch?v=YvvPeimqLQI,@crissr9918,"Canal 1 tampoco es imparcial, se vende al otro extremo, la izquierda.",hace 4 años,5
https://www.youtube.com/watch?v=YvvPeimqLQI,@germamgomez6074,Eso sí se defiende muy bien,hace 4 años,2
https://www.youtube.com/watch?v=YvvPeimqLQI,@cesarantoniomorenosanchez3533,Esa ministra se rajó se sepultó,hace 4 años,6
https://www.youtube.com/watch?v=YvvPeimqLQI,@angelpotter2266, @cesarantoniomorenosanchez3533  tenía que ser Costeña... Ese engendró,hace 4 años (editado),8
https://www.youtube.com/watch?v=YvvPeimqLQI,@santiiagoarboleda3481, @angelpotter2266  jajaja,hace 4 años,0
https://www.youtube.com/watch?v=YvvPeimqLQI,@arnolflorezmartinez6666,Cuál defenderse bien? Las explicaciones que da no convencen ni al juez más corrupto del 🌎,hace 4 años,4
https://www.youtube.com/watch?v=YvvPeimqLQI,@jhonjairocaromerino7837, @angelpotter2266  Aca hay ladrones corruptos en todas las regiones.,hace 4 años,5
https://www.youtube.com/watch?v=YvvPeimqLQI,@albertodiaz2431," @angelpotter2266  cómo así? Ladrones los hay en todas parte. Los cachacos son los que han manejado el después de Núñez, te parecen excelentes?",hace 4 años,1
https://www.youtube.com/watch?v=YvvPeimqLQI,@DiegoParrado07," @SrDallan02  Tengo entendido que los costeños llaman a los del interior ""cachacos"", déjeme decirle que lo que dice es falso, las mejores épocas gubernamentales que generaron un desarrollo en la infraestructura ha sido con Rojas Pinilla y algunos regímenes multipartidistas dirigidas por políticos del interior que han dado desarrollo a la industria del país.
Las ideas liberales y federalistas defendidas por los del interior sentaron la propuesta de industrializar la economía y darle autonomía a los departamentos y provincias.
En la Época de la Hegemonía Conservadora, cuando pasó el primer siglo de guerras civiles sangrientas entre federalistas y centralistas, se empezó el desarrollo de la producción cafetera en el país, incidiendo en el aumento de ingresos de divisas en años posteriores, con esto se pudo finalizar de forma eficiente carreteras y otras obras públicas de infraestructura.
En los años 30 empieza la creación de diferentes instituciones financieras y bancos, para sentar las bases de un desarrollo en la Industria colombiana...
Al decir verdad, en el contexto histórico, se ha dado un paso de desarrollo en infraestructura e industrialización con las políticas de regímenes impuestas por políticos del interior.
Lo que nos ha atrasado son las guerras civiles que socavaron diferentes aspectos sociales de Colombia, y nos atrasó en su tiempo en lo que sería la Revolución Obrera, siendo fundamental tiempo después para la industrialización del país. Sin olvidar que gracias a estas guerras y conflictos bélicos, trae consigo una inestabilidad política, económica y social.",hace 4 años (editado),3
https://www.youtube.com/watch?v=YvvPeimqLQI,@brayantorres5184," @DiegoParrado07  Exquisita información, muy entendible y bien argumentado, gracias por compartir la historia y pelear contra la desinformación e ignorancia!!",hace 4 años,1
https://www.youtube.com/watch?v=YvvPeimqLQI,@DiegoParrado07," @albertodiaz2431  Lee el comentario que dejé más arriba, ahí explico que en esas épocas, se peleaban regímenes e ideologías, no un líder político en general, es más, también dejo información relevante donde muestra que el desarrollo industrial y de infraestructura es generada por políticas impuestas por políticos del interior del país.",hace 4 años (editado),3
https://www.youtube.com/watch?v=YvvPeimqLQI,@SrDallan02," @DiegoParrado07  pero... jajaja, tú eres el que estas insultando a los costeños  y dejate tanta palabrería, que Rojas Pinilla se consideraba más cacahaco que boyacence además llegó al estado fue con golpe de estado y si hablamosde presidente te tengo al señor Rafael Nuñez presidente Costeño y el creador de la hermosa letra de nuestro himno nacional. Sales hablando de política y otras cosas, cuando en tu primer comentario discriminatorio, me enrva las personas  como tú. Joder",hace 4 años,0
https://www.youtube.com/watch?v=YvvPeimqLQI,@SrDallan02, @brayantorres5184  información que puedes encontrar en Wikipedia.🤷‍♂️,hace 4 años,0
https://www.youtube.com/watch?v=YvvPeimqLQI,@DiegoParrado07," @SrDallan02  Esa no es información de Wikipedia, la información la puedes encontrar en libros como
- Historia Económica de América Latina desde la Independencia - Víctor Búlmer-Thomas.
- Café y conflicto en Colombia, 1886-1910  Charles Becquist.
- Colombia y la economía mundial - Jose Antonio Ocampo.
- Colonización y protesta campesina, 1850-1950 - Catherine Legrand. 
Estos libros ponen información en mesa sobre el contexto histórico de las guerras y el desarrollo de la economía colombiana en el siglo XIX y siglo XX.",hace 4 años (editado),2
https://www.youtube.com/watch?v=YvvPeimqLQI,@SrDallan02," @DiegoParrado07  ah bueno mi comentario lo hice para alguien que insultó a los costeños, pero como veo que tú fuiste el que respondió mi comentario, de todas formas disculpas y por lo otro ya dejémonos de palabrería y politiquería. Todo eso  de nada de eso le ha servido al país.",hace 4 años,0
https://www.youtube.com/watch?v=YvvPeimqLQI,@SrDallan02," @brayantorres5184  vea señora callese, que usted no sabe de que se está hablando. Así que callese  callese 🤣",hace 4 años,0
https://www.youtube.com/watch?v=YvvPeimqLQI,@brayantorres5184," @SrDallan02  Jajajaja, mejo cállese usted que está quedando en ridículo, no es señora por cierto jajajaja",hace 4 años,0
https://www.youtube.com/watch?v=YvvPeimqLQI,@SrDallan02," @DiegoParrado07  el señor victor bulmer thomas es buen escritor si, pero es solo eso un escritor y economista inglés. 
-Café y conflicto en Colombia; se muy los antecedentes y consecuencias que dejo la guerra de los mil días, en los respectivos a la población colombiana. 

Aquí en Colombia siempre ha sido así las guerras siempre han afectado a los más pobres y a enriquecido a los más acomodados.",hace 4 años,0
https://www.youtube.com/watch?v=YvvPeimqLQI,@DiegoParrado07," @SrDallan02  Esos libros expuestos son recomendados para entender de donde estudio y aprendo la información que manifiesto, Bulmer Thomas es un escritor que desarrolló escritos concretos y argumentados breves de la historia de Colombia y América Latina en general.
En cuanto a lo otro, la mayoría de estos libros también hablan de períodos y desarrollo progresivo en la economía del país, además de hablar de las guerras civiles lógicamente, estas guerras se desarrollan incluso años antes de nuestra guerra definitiva de Independencia (La Patria Boba) que se vuelven antecedentes y causas para otras guerras civiles y la inestabilidad de épocas posteriores.",hace 4 años (editado),0
https://www.youtube.com/watch?v=YvvPeimqLQI,@carmencecilianavarrodearen3935,Es una mapana peligrosa Dios nos guarde y así son todos los políticos,hace 4 años,3
https://www.youtube.com/watch?v=YvvPeimqLQI,@alejandrovelez6675,ya tendria casi  70mil millones,hace 4 años,5
https://www.youtube.com/watch?v=YvvPeimqLQI,@margaritaavila2781, @alejandrovelez6675  siiii... yá se hubiera reunido los 70 mil millones 😆😆😆,hace 4 años,2
https://www.youtube.com/watch?v=YvvPeimqLQI,@xifa2h,Ya tendría para pagar el plan de Internet,hace 4 años,2
