video_url,author,text,time,votes
https://www.youtube.com/watch?v=YvvPeimqLQI,@derliydiaz1490,"Y eso solo fue la punta del iceberg
Nunca se sabrá el resto de chanchullos que el fiscal general tiene archivado",hace 2 años,0
https://www.youtube.com/watch?v=YvvPeimqLQI,@dariocano6264,Cumplió? En qué cementerio está para llevarle Flores,hace 3 años,0
https://www.youtube.com/watch?v=YvvPeimqLQI,@atiliobenavides9651,NO HA CUMPLIDO Y LA PLATA SE LA ABUDINEO.,hace 2 años,0
https://www.youtube.com/watch?v=YvvPeimqLQI,@ColombiaTechbog-sh8xo,LA PREGUNTA ES...AL DIA DE HOY CUMPLIO..😊,hace 2 años,0
https://www.youtube.com/watch?v=YvvPeimqLQI,@carlosalfonsoruiz6055,El mejor🎉🎉🎉🎉,hace 2 años,0
https://www.youtube.com/watch?v=YvvPeimqLQI,@yutu38,"Caracol dejando ir a Juan Diego Alvira, fue como el Real Madrid dejando ir a Cristiano.",hace 1 año,0
https://www.youtube.com/watch?v=YvvPeimqLQI,@gustavopolo3196,Se pasó el tiempo y se perdió ese dinero,hace 2 años,0
https://www.youtube.com/watch?v=YvvPeimqLQI,@jesuscastro1469,Y los terminaron al fin o no ?,hace 1 año,0
https://www.youtube.com/watch?v=YvvPeimqLQI,@jaorjaor656,"Cuando vuelvo a ver esto, vuelvo a dudar si quiero trabajar para el estado o seguir en los operadores privados así se gane menos dinero",hace 2 años,0
https://www.youtube.com/watch?v=YvvPeimqLQI,@jesushumbertogarciagarcia9447,Con el 10 % le vasto y le sobro,hace 2 años,0
https://www.youtube.com/watch?v=YvvPeimqLQI,@michellguerrero8341,Esas no cumplen ni años 🤮🤮🤮,hace 3 años,0
https://www.youtube.com/watch?v=YvvPeimqLQI,@carmengomez855,Desvergonzada.,hace 3 años,1
https://www.youtube.com/watch?v=YvvPeimqLQI,@arihernandocollazos756,La misma cara y forma de actuar de María Fernanda cabal las dos care lápidas de Colombia que peligro Dios nos protege de mal y peligro 😭,hace 3 años,1
https://www.youtube.com/watch?v=YvvPeimqLQI,@juandavidvegapacheco8874,Sin duda este si es un periodista no tiene  bandos,hace 10 meses,0
https://www.youtube.com/watch?v=YvvPeimqLQI,@Alcibar78,Eso sí es noticia y periodista de verdad.,hace 1 año,0
https://www.youtube.com/watch?v=YvvPeimqLQI,@jesusoliverosgamez2277,"No Cumplió nunca, y esa plática se perdió.... 😂",hace 1 año,0
https://www.youtube.com/watch?v=YvvPeimqLQI,@cesarfajardo3857,"Gracias porque así es que se hace profesionalismo Albita es buen periforidars, triste que no haya Libertad de prensa",hace 2 años,0
https://www.youtube.com/watch?v=YvvPeimqLQI,@JoseMarquez-p6v,Excelente   juan Diego,hace 2 años,0
https://www.youtube.com/watch?v=YvvPeimqLQI,@eduardosolarte4145,"Si no cumplía, se lo enterrabn
...",hace 1 año,0
https://www.youtube.com/watch?v=YvvPeimqLQI,@Safeale3,Al buen pastor.,hace 2 años,0
https://www.youtube.com/watch?v=YvvPeimqLQI,@lucho548i,"La mejor acorralada en periodismo, excelente hoy 1 de mayo de 2023 lo recuerdo gracias Juan Diego.",hace 2 años,0
https://www.youtube.com/watch?v=YvvPeimqLQI,@miryamastridbedoya224,"No puedo creerlo,Nestor Morales.Waooo",hace 1 año,0
https://www.youtube.com/watch?v=YvvPeimqLQI,@fabioeliasbartolo3253,Por eso sacarlo a.juan diego alvira,hace 2 años,0
https://www.youtube.com/watch?v=YvvPeimqLQI,@naizadelcarmencastrocanchi2838,Embuste ...Señora Karen,hace 1 año,0
https://www.youtube.com/watch?v=YvvPeimqLQI,@andresfelipearca2747,"Grande Juan Diego Alvira, Grande❤👏👏👏",hace 2 años,0
https://www.youtube.com/watch?v=YvvPeimqLQI,@luzeltinminota185,"Lleve la al cementerio por no cumplir, eso fué lo q ella dijo",hace 2 años,0
https://www.youtube.com/watch?v=YvvPeimqLQI,@elimelethvillarruel4959,"El mérito Sele da al periodista, no al canal, porque casi le cuesta el puesto.",hace 2 años,0
https://www.youtube.com/watch?v=YvvPeimqLQI,@blasramos9378,Esta señora se contradice😅😅😂😂😂,hace 2 años,0
https://www.youtube.com/watch?v=YvvPeimqLQI,@edwinalexisgonzalezpabon9728,Y se terminó perdiendo esa plática como en toda política solo son ladrones,hace 2 años,0
https://www.youtube.com/watch?v=YvvPeimqLQI,@JoseRuiz-pr6vp,Por que a alguien que se robo todo ese dinero le siguen diciendo mimisrt? a,hace 1 año,0
https://www.youtube.com/watch?v=YvvPeimqLQI,@marcosgarciaponare9672,Caracol des pues qe Diego salió no ávido un perio dista como juandiego al vira,hace 2 años,0
https://www.youtube.com/watch?v=YvvPeimqLQI,@afor910327910327,Amo este senor.,hace 2 años,0
https://www.youtube.com/watch?v=YvvPeimqLQI,@Jorgeeliecercarlier,Las ganas de seguir robando,hace 1 año,0
https://www.youtube.com/watch?v=YvvPeimqLQI,@juansierra3370,"Es 2024, mi pregunta es ¿ya se fue al cementerio?",hace 1 año,0
https://www.youtube.com/watch?v=YvvPeimqLQI,@WILL_TECHNICAL,"No respondió a la pregunta.. tan fácil como decir .. Incumplí. Ya todo Colombia sabe que ésta cara dura se robó el dinero de la conectividad, y no solo eso .. le faltó responder.. a cual cementerio le gustaría ir.",hace 3 años,0
https://www.youtube.com/watch?v=YvvPeimqLQI,@NelsonCarreno1,Jajaja Jajaja chanchulleros de todos los politicos,hace 1 año,0
https://www.youtube.com/watch?v=YvvPeimqLQI,@juanbernal8396,Ojalá este pasquín siempre fuera así.,hace 3 años,0
https://www.youtube.com/watch?v=YvvPeimqLQI,@joacobuitrago9111,Todo corrupto tiene un menú de respuestas para salir del delito,hace 2 años,0
https://www.youtube.com/watch?v=YvvPeimqLQI,@victorcarrero3437,Muy bien por alvira,hace 1 año,0
https://www.youtube.com/watch?v=YvvPeimqLQI,@marielaromerocruz6364,Jaaaa ella es la que manejaba,hace 2 años,0
https://www.youtube.com/watch?v=YvvPeimqLQI,@nestorescobar3530,2023 y todavía me preguntó dónde están los 70mil millones 😢😢😢😢se los abudinearon 😢😢😢😢,hace 2 años,0
https://www.youtube.com/watch?v=YvvPeimqLQI,@RodrigoMoncayo-k7k,Nestor como cienpre en Redando todo,hace 1 año,0
https://www.youtube.com/watch?v=YvvPeimqLQI,@Valkmi666,"Sin pena ni gloria, ahí está tranquis en la calle.",hace 1 año,0
https://www.youtube.com/watch?v=YvvPeimqLQI,@freddyocampo7869,Que sinismo 😅 que burla,hace 2 años,0
https://www.youtube.com/watch?v=YvvPeimqLQI,@anadelcarmenmelchor7569,"Gracias Juan Diego, lo felicito por actuar con rectitud como periodista,   todos encuentran escusasa la hora de dar respuestas falsas, donde es el entramado de ladrones. Que si se aprenden muy bien la tarea de como enredarnos a los Colombianos, y somos tan inocentes que caemos como en tiempos anteriores y aún nos enboban con espejitos para quitarnos lo que por derecho nos pertenece. Parece que el tiempo no avanza nos quedamos en el año 1492.",hace 3 años,0
https://www.youtube.com/watch?v=YvvPeimqLQI,@carmenstellazapata6008,Uy se prestó a el engaño 😮,hace 1 año,0
https://www.youtube.com/watch?v=YvvPeimqLQI,@vilapeli4818,Todavia la estamos esperando.. ya  me lo descargué así que de nada sirve que lo borren gracias,hace 1 año,0
https://www.youtube.com/watch?v=YvvPeimqLQI,@luisnoriega5094,No está presa solo paseo de Miami,hace 3 años,0
https://www.youtube.com/watch?v=YvvPeimqLQI,@luisgabrielvilllafernandez3244,😂🤡🤡🤡🤡,hace 1 año,0
https://www.youtube.com/watch?v=YvvPeimqLQI,@alexanderjimenez5883,Juan Diego eres increíble,hace 1 año,0
https://www.youtube.com/watch?v=YvvPeimqLQI,@florangelarendonrendon430,Y la platica al fin se perdio quien la esta disfrutando,hace 2 años,0
https://www.youtube.com/watch?v=YvvPeimqLQI,@danielcastro5268,Que belleza......@Nestor Morales,hace 1 año,0
https://www.youtube.com/watch?v=YvvPeimqLQI,@fabianrodriguez4601,No se porque pero siento que estaba mintiendo desde la primera vez,hace 2 años,0
https://www.youtube.com/watch?v=YvvPeimqLQI,@luisalejandroparrarodrigue2109,YA ESTÁ LA HORA QUE NO APARECIÓ ESA PLATA,hace 8 meses,0
https://www.youtube.com/watch?v=YvvPeimqLQI,@jacquelineibanez8431,No es capaz de reconocer la realidad ! Destituirla ! Ya no mas ! 💩💩💩💩💩💩💩💩,hace 1 año,0
https://www.youtube.com/watch?v=YvvPeimqLQI,@jamescastro5447,Ya devolvieron  el DINERO  hurtado,hace 2 años,0
https://www.youtube.com/watch?v=YvvPeimqLQI,@JairoParrado,Fue su despido 😂,hace 11 meses,0
https://www.youtube.com/watch?v=YvvPeimqLQI,@orlandoforero6315,Corruptos incumplidos 😂😂😂😂,hace 2 años,0
https://www.youtube.com/watch?v=YvvPeimqLQI,@ing.davidricardolopezr6207,"Ahora ellos dicen que salvarán a Colombia, cínicos y descarados, en donde está la plata?",hace 1 año,0
https://www.youtube.com/watch?v=YvvPeimqLQI,@alelfo1982,Sigue libre y la plata no aparece,hace 1 año,0
https://www.youtube.com/watch?v=YvvPeimqLQI,@AlexanderFranco-iv4qs,Única entrevista con veracidad en robo q presento por.primera vez ese noticiero,hace 1 año,0
https://www.youtube.com/watch?v=YvvPeimqLQI,@JUANCARLOS-gy9hz,Debería volver Juan Diego.,hace 2 años,0
https://www.youtube.com/watch?v=YvvPeimqLQI,@CamiCamilo,Casi echa a diego por preguntar mucho,hace 5 meses,0
https://www.youtube.com/watch?v=YvvPeimqLQI,@ISRAELGONZALEZ-ql9jp,Yo creo que  por esta entrevista le costó el puesto a Juan Alvira porque caracol radio y televisión estan a favor de la corrupción.,hace 2 años,0
https://www.youtube.com/watch?v=YvvPeimqLQI,@javierandrespulgarin4376,X esta razón echaron a Juan Diego alvira,hace 2 años,0
https://www.youtube.com/watch?v=YvvPeimqLQI,@drjuanvilla,Costeña tenía que ser.,hace 2 años,0
https://www.youtube.com/watch?v=YvvPeimqLQI,@adolfocotes8162,Cuando va a devolver lo que se robó.,hace 1 año,0
https://www.youtube.com/watch?v=YvvPeimqLQI,@anaelvirapastor56,Juan Diego Alvira se copia de Fernando del Rincón...😆😂🤣🤣🤣,hace 3 años,0
https://www.youtube.com/watch?v=YvvPeimqLQI,@martaluciaecheverri3453,Juan Diego Aivira periodista de verdad,hace 2 años,0
https://www.youtube.com/watch?v=YvvPeimqLQI,@JoséBertielPatiñoGómez,Si caracol fuera asi siempre colombia lo amaria.,hace 1 año,0
https://www.youtube.com/watch?v=YvvPeimqLQI,@Lucho_Silva,Todas las preguntas que le hacen ella se va por las ramas... he visto gente que ha pagado cárcel por robarse una chocolatina de 2mil pesos,hace 3 años,0
https://www.youtube.com/watch?v=YvvPeimqLQI,@migueldarioguzman6267,"Gracias a Dios la gente se da de. Cuenta la clase política .
Es duro pero es la verdad q no cumplió no cumplió eso es política la política es así 
Esa platica se perdio",hace 3 años,0
https://www.youtube.com/watch?v=YvvPeimqLQI,@augustotuta21,Quien se robo la plata ?,hace 1 año,0
https://www.youtube.com/watch?v=YvvPeimqLQI,@JoseJoaquinMacias,Envés de criticar váyase para el río Coello que lo están acabando ayude lleve cámaras y dibulge 🎉🎉,hace 3 meses,0
https://www.youtube.com/watch?v=YvvPeimqLQI,@johnjairo4637,Lo mejor que a hecho Caracol noticias fue tener a este periodista,hace 1 año,0
https://www.youtube.com/watch?v=YvvPeimqLQI,@marianoflorez19,Esa es la actitud rebelde. Que deberían. Adoptar siempre los periodistas.  Y no salir a babosear  el guión. Que les imponen los medios tradicionales,hace 2 años,0
https://www.youtube.com/watch?v=YvvPeimqLQI,@rubiamabelehrlichdiaz1083,Y lo despidieron por decir la verdad????😮,hace 1 año,0
https://www.youtube.com/watch?v=YvvPeimqLQI,@miryamastridbedoya224,Hasta se sonríe que sinica.,hace 1 año,0
https://www.youtube.com/watch?v=YvvPeimqLQI,@carolinapulido1319,Se volaron con la plata de nuestros impuestos,hace 1 año,0
https://www.youtube.com/watch?v=YvvPeimqLQI,@wilsonmeneses1603,Karen para cuando la plata ?,hace 2 años,0
https://www.youtube.com/watch?v=YvvPeimqLQI,@davidfernandopuche10,Despues de esa entrevista le llamaron la atencion a Juan Diego Alvira y ahora es el que vemos hablando de san andres y cosas que no tienen nada que ver...,hace 3 años,0
https://www.youtube.com/watch?v=YvvPeimqLQI,@hectoringarces2405,Nunca lucho solo robo,hace 3 años,1
https://www.youtube.com/watch?v=YvvPeimqLQI,@vejete79,"No cumplió y desapareció no solo el dinero de la conectividad, desaprecio las posibilidades de conexión y al día de hoy está impune",hace 1 año,0
https://www.youtube.com/watch?v=YvvPeimqLQI,@pataloka653,Que descaro por favor esa mujer,hace 2 años,0
https://www.youtube.com/watch?v=YvvPeimqLQI,@ochoplay6713,2024 Y NO PASA NADA,hace 1 año,0
https://www.youtube.com/watch?v=YvvPeimqLQI,@yurialfredonarvaezdiaz177,"Karen la plata,, la plataaa",hace 2 años,0
https://www.youtube.com/watch?v=YvvPeimqLQI,@danielfguzmanm8259,Reacción de una persona culpable,hace 2 años,0
https://www.youtube.com/watch?v=YvvPeimqLQI,@willaten06,"Mayo 2023, se perdió esa plata. 73 mil.",hace 2 años,0
https://www.youtube.com/watch?v=YvvPeimqLQI,@meryavendano3666,"Pero ""encaró"" qué tal",hace 4 meses,0
https://www.youtube.com/watch?v=YvvPeimqLQI,@cesaryanguas2399,Y ya hoy (2024  8 de marzo) ni un detenido nadie pago carcel nadie respondio por el dinero... todos comieron la ministra el pelmaso de duque los medios no hicieron mas buya no investigaron mas ... en fin este es circlombia... y la poliiqueria de 💩,hace 1 año,0
https://www.youtube.com/watch?v=YvvPeimqLQI,@JorgeMoralesflorez-rr9bj,Katrehp,hace 1 año,0
https://www.youtube.com/watch?v=YvvPeimqLQI,@hugoantoniopuchecampuzano9009,Y pensar q anda libre como el viento..,hace 1 año,0
https://www.youtube.com/watch?v=YvvPeimqLQI,@Lmpm2225,Acorralada jajaja,hace 1 año,0
https://www.youtube.com/watch?v=YvvPeimqLQI,@KariyaKagetoki,Juan diegod alvirq,hace 2 años,0
https://www.youtube.com/watch?v=YvvPeimqLQI,@yanethmendoza5081,Jajajaja se fue de popis,hace 1 año,0
https://www.youtube.com/watch?v=YvvPeimqLQI,@albertoramirez4220,Ya ceba por las por las ramas como todo y le hechan tierrita y perdido se quedó,hace 1 año,0
https://www.youtube.com/watch?v=YvvPeimqLQI,@empresariomentors,Por eso lo echaron de caracol 🤣,hace 2 años,0
https://www.youtube.com/watch?v=YvvPeimqLQI,@Brianesteb87,"Juan Diego le llevo nivel al noticiero, que gran profesional 👏🏻👏🏻👏🏻",hace 1 año,0
https://www.youtube.com/watch?v=YvvPeimqLQI,@jota178,RARO CARACOL HACIENDO BUEN PERIODISMO EXTRAÑISIMO,hace 2 años,0
https://www.youtube.com/watch?v=YvvPeimqLQI,@ergaviria,Se quedó con las meras ganas. Y dónde están los 70.000 millones,hace 2 años,0
https://www.youtube.com/watch?v=YvvPeimqLQI,@adielavalencia2938,no cunplio  mentirosa igual q todos,hace 3 años,1
https://www.youtube.com/watch?v=YvvPeimqLQI,@HectorSanchez-s8m,Y nunca hicieron conversaciones de pais por esto.😂,hace 9 meses,0
https://www.youtube.com/watch?v=YvvPeimqLQI,@andresbermudez3751,"Increíble que está señora este libre, sin ninguna consecuencia.",hace 2 años,0
https://www.youtube.com/watch?v=YvvPeimqLQI,@aicardocardenas5732,Don de quedo la plata,hace 2 años,0
https://www.youtube.com/watch?v=YvvPeimqLQI,@Franco19841,Juan Diego es un sensei.🤪,hace 2 años,0
https://www.youtube.com/watch?v=YvvPeimqLQI,@mariaelenalizarazo9042,Y todo quedo asii y no paso nada a esta  mujer la premiaron después con una alcaldía creo,hace 2 años,0
https://www.youtube.com/watch?v=YvvPeimqLQI,@javierandrespulgarin4376,Juan digo alvira es mi ídolo  está minitra si es decorada   juan diego 👍🏼👍🏼👍🏼👍🏼🌹,hace 2 años,0
https://www.youtube.com/watch?v=YvvPeimqLQI,@adelamazoorrego1868,No cumplió  eligieron unentramado,hace 1 año,0
https://www.youtube.com/watch?v=YvvPeimqLQI,@deporcalidavid,Ojala que las entrevistas a todos los políticos sin importar su corriente fueran asi porque sea de izquierda o derecha hay tremendos pillos,hace 2 años,0
https://www.youtube.com/watch?v=YvvPeimqLQI,@joseromero7782,Ola Juan Diego A cómo dijo contá huesos hoy huy huy huy párese que nos tumbaron los 70 mil M jajajaja 😆 jajaja,hace 1 año,0
https://www.youtube.com/watch?v=YvvPeimqLQI,@EdgardBnavidsCortina,Y donde estan los 70 mil millones ?,hace 1 año,0
https://www.youtube.com/watch?v=YvvPeimqLQI,@bibianaescobar8439,Y dónde está esa señora?,hace 2 años,0
https://www.youtube.com/watch?v=YvvPeimqLQI,@arnoldpatio5908,Debe ir al cementerio asi es 😂😂😂😂 que cuento de claro. Promesas y promesas.,hace 1 año,0
https://www.youtube.com/watch?v=YvvPeimqLQI,@autoestimanoesigualaeg00rg89,"y la plata que se 
r0-b0 ,lo del internet ,cuando la devolvera?
digame a los CHARR,
GERLEIN. 🙄",hace 2 años,0
https://www.youtube.com/watch?v=YvvPeimqLQI,@diegomanjarrez9362,"desde que el salió de caracol ya no hay nada que ver en ese canal, eso era periodismo",hace 2 años,0
https://www.youtube.com/watch?v=YvvPeimqLQI,@juanjosemedinavasquez6788,Por eso le costó el puesto al gran periodista Juan Diego Alvira,hace 2 años,0
https://www.youtube.com/watch?v=YvvPeimqLQI,@abimamanjarrez4718,Corrupción pura,hace 1 año,0
https://www.youtube.com/watch?v=YvvPeimqLQI,@fabiolabelalcazarcuartas6981,Felicitaciones Juan diego así se hace esto siempre pasa no cumplen y todo se pierde y los niños siguen esperando q fraude sr ministra,hace 3 años,0
https://www.youtube.com/watch?v=YvvPeimqLQI,@carolinarojas1779,"Ojalá caracol fuese así siempre, pero miren como está la corte, la fiscalía, el congreso y caracol calladito",hace 1 año,0
https://www.youtube.com/watch?v=YvvPeimqLQI,@jairopolania5326,Su correcta labor periodística le costo su trabajo...afortunadamente no su profesionalismo!,hace 2 años,0
https://www.youtube.com/watch?v=YvvPeimqLQI,@carloscastillohoyos8084,😊cuando sea grande quiero ser Juan Diego Alvira. Que periodista fuera de serie. Fue una entrevista que pasará a la historia.,hace 1 año,0
https://www.youtube.com/watch?v=YvvPeimqLQI,@reynaldovecino2329,Si te quedaste con los 70000 mil,hace 1 año,0
https://www.youtube.com/watch?v=YvvPeimqLQI,@MARIOALIRIOPALACIOSQUICENO,DESPUES DE TRES AÑOS SIGO SORPRENDIDO,hace 3 meses,0
https://www.youtube.com/watch?v=YvvPeimqLQI,@miamigokruger,Cumplirle a los niños dice…. Que bajeza de personaje 🤦🏻‍♂️,hace 2 años,0
https://www.youtube.com/watch?v=YvvPeimqLQI,@amparochavez8261,"Juan Diego nos encanta muchísimo hasta donde ud se mete ,sus investigaciones entrevistas etc etc son un genio ,ud esta por lo alto en prifesionalidad ,nos encantan sus preguntas ud no se deja intimidar de nadie bravo 👍 tener periodistas de esta indole sin odio ni rencor ,siga neutro ignore eso lo hace mas valioso como profesional",hace 2 años,0
https://www.youtube.com/watch?v=YvvPeimqLQI,@smc4236,"Hoy, la Procuraduría archivó el proceso.

El país de la impunidad.",hace 1 año,0
https://www.youtube.com/watch?v=YvvPeimqLQI,@santiagolopez656,"Jajajajajaja cuando extrañan a Juan Diego. Tuvieron problema con ese enfrentamiento, pero no con monetizar.",hace 2 años,0
https://www.youtube.com/watch?v=YvvPeimqLQI,@mariavargas1672,Hola Juan Diego. Eres genial y un pedriodista de berdad. Felicitaciones. Eres el mejor y el mejor dios. Te bendiga,hace 2 años,0
https://www.youtube.com/watch?v=YvvPeimqLQI,@vicktorsolis652,D.esg.racia.da,hace 1 año,0
https://www.youtube.com/watch?v=YvvPeimqLQI,@Calabocacaralho87,Ese es un crack!,hace 2 años,0
https://www.youtube.com/watch?v=YvvPeimqLQI,@astrofisc,"Y siguen robados los 70 barritas y la señora, muy bien gracias, el entramado era para robarnos qué cínica!",hace 1 año,0
https://www.youtube.com/watch?v=YvvPeimqLQI,@cristiancamilochaconrodrig5117,Enrredadora jejeje,hace 2 años,0
https://www.youtube.com/watch?v=YvvPeimqLQI,@robertoarnedo1714,POR PREGUNTAR LO CORRECTO CARACOL LO ECHO❤❤,hace 1 año,0
https://www.youtube.com/watch?v=YvvPeimqLQI,@megadeth899,Pensar q esto le costó el puesto a este loco... Lastima que cuando hacen un trabajo serio y decente y expone a esos funcionarios ineptos termina en la calle...,hace 2 años,0
https://www.youtube.com/watch?v=YvvPeimqLQI,@marielaromerocruz6364,Huy si como  los  conecto    jaaaa  ya cuando robo y quiere seguir luchando para haber cuanto mas podia  robar mas,hace 2 años,0
https://www.youtube.com/watch?v=YvvPeimqLQI,@nicolasgarces5741,Quiero de nuevo a Juan Diego el estaba de parte de la gente,hace 2 años,0
https://www.youtube.com/watch?v=YvvPeimqLQI,@inesladino1903,Diego alvira se fue lo mejor de noticias caracol hombre que no le da miedo hablar  y  decirle la verdad al que sea en la cara👏🏿👏🏿👏🏿👏🏿👏🏿👏🏿👏🏿👏🏿👏🏿👏🏿👏🏿👏🏿,hace 3 años,0
https://www.youtube.com/watch?v=YvvPeimqLQI,@albertorafaelbermejo3380,Le llamaron la atención por esa entrevista casi lo botan lo salvó Néstor Morales y los mensajes que enviaron a caracol los televidentes,hace 2 años,0
https://www.youtube.com/watch?v=YvvPeimqLQI,@jhoncortez3211,Parce esa vez a sido la voleta mas grande de Colombia robarsem toda esa plata y no pasar nada ufff parce,hace 1 año,0
https://www.youtube.com/watch?v=YvvPeimqLQI,@JOHNRODRIGUEZ-di3dm,CARACOL DEBERIA RETOMAR ESTOS TEMAS PARA SUBIR RATING....¿Y HACERLE SEGUIMIENTO A QUE PASO CON LOS 72.000 MILLONES DE PESOS?,hace 2 años,0
https://www.youtube.com/watch?v=YvvPeimqLQI,@pabloamaya758,En resumen se robaron los 70 mil millones y no pasó nada q triste  como se pierde el dinero de los colombianos,hace 1 año,0
https://www.youtube.com/watch?v=YvvPeimqLQI,@BlancainesGonzales,No cumplió sigue enredado la pita 😅,hace 1 año,0
https://www.youtube.com/watch?v=YvvPeimqLQI,@andreapalacios3416,Por esto echaron a Juan de noticias Caracol y taparon todo cuando lo recibieron en semana. Lo callaron,hace 2 años,0
https://www.youtube.com/watch?v=YvvPeimqLQI,@carlossampayo8810,Juan de hoy Yo soy analfabeto yo no soy estudiado ni nada de eso yo estoy hablando aquí por el micrófono del teléfono cómo haríamos para comunicarnos no sé mi amigo para que me solucionen ese problema y esa diligencia que tengo que hacer,hace 1 año,0
https://www.youtube.com/watch?v=YvvPeimqLQI,@OrlandoVelasquez-s3h,Y qué pasó con la plata con los 70 000 millones de pesos qué se emborracharon?,hace 1 año,0
https://www.youtube.com/watch?v=YvvPeimqLQI,@jarroyv.baenart5474,Por ahí me topé con el fantasma de Abudinem... estaba comprando zapatos.,hace 1 año,0
https://www.youtube.com/watch?v=YvvPeimqLQI,@danielflorencia1991,Me voy a tatuar a ese señor en el pecho....ya que el si le puso el pecho a la corrupción...,hace 2 años,0
https://www.youtube.com/watch?v=YvvPeimqLQI,@didiermejia5119,Se quedó solo con las ganas de conectar...... No se qué...pero el que si la saco del estadio fue el señor Juan diego😂,hace 2 años,0
https://www.youtube.com/watch?v=YvvPeimqLQI,@breinerarmandochinchianava262,"En un pais democrático y decente, donde importa el ciudadano, la juventud y sobre todo la niñez, un gobierno que causa desigualdad economica y social estructural.",hace 2 años,0
https://www.youtube.com/watch?v=YvvPeimqLQI,@jascbenk09,esta entrevista ya tiene el año  y la verdad quede sorprendido que CARACOL  se atreva a desmascarar a los corruptos del gobierno,hace 2 años (editado),0
https://www.youtube.com/watch?v=YvvPeimqLQI,@jesuseduardotenorioarcinie1080,"Y por esto Juan Diego Alcira perdió su trabajo en caracol porque ya después no lo dejaron hacer esta clase de cosas, donde de verdad le hacía las jugadas a esos politiqueros que siempre prometen y no cumplen Bendicones Juan Diego ❤",hace 2 años,0
https://www.youtube.com/watch?v=YvvPeimqLQI,@snowandcorn,El descaro en colombia es descarado,hace 1 año,0
https://www.youtube.com/watch?v=YvvPeimqLQI,@LuisGonzalez-om8yi,Cómo ganguea,hace 2 años,0
https://www.youtube.com/watch?v=YvvPeimqLQI,@jorgebarrera9300,"Primera vez que veo a Caracol haciendo bien el trabajo, muy bien",hace 1 año,0
https://www.youtube.com/watch?v=YvvPeimqLQI,@nelsonrivas1373,Para cuando cárcel para está corrupta,hace 1 año,0
https://www.youtube.com/watch?v=YvvPeimqLQI,@davidcanon3040,"Conclusión a Colombia la han robado siempre, que lamentable.",hace 1 año,0
https://www.youtube.com/watch?v=YvvPeimqLQI,@juancarlospolotorres9286,Asi deben ser los periodistas .... Hablar y preguntar claro no buscar evasivas como lo hace esta ex ministra que nunca jamas debera ser funcionaria,hace 2 años,0
https://www.youtube.com/watch?v=YvvPeimqLQI,@freddygamboa7981,"Mi pregunta cuanto debe ganar esa gente para que dejen de estar pensando en dinero y hagan bien su trabajo  ???         🤔
Les contesto , nunca encontraran una cifra la avaricia les gana     😠🤬🤬",hace 2 años,0
https://www.youtube.com/watch?v=YvvPeimqLQI,@jhonfreddyortegavillalobos1045,Abudinen sepulto todas sus aspiraciones políticas....,hace 1 año,0
https://www.youtube.com/watch?v=YvvPeimqLQI,@KarinaTapia-g9j,"Esa plática se perdió, como todo lo de este país",hace 1 año,0
https://www.youtube.com/watch?v=YvvPeimqLQI,@armandocristancho5668,"Se abudeneo todo y no pasó nada por Ser de la rosca,",hace 2 años,0
https://www.youtube.com/watch?v=YvvPeimqLQI,@JoseMunoz-wv2bp,Alguien en 2023??,hace 2 años,0
https://www.youtube.com/watch?v=YvvPeimqLQI,@LinaCarreño-v3k,"Pero ella resulto libre, no le comprobaron mada .
😊",hace 1 año,0
https://www.youtube.com/watch?v=YvvPeimqLQI,@dariannyvillalobos678,Muchas felicitaciones a Juan Diego por esa entrevista mucho cuento,hace 2 años,0
https://www.youtube.com/watch?v=YvvPeimqLQI,@olgalibiamendezcardenas9237,"Bien por Juan Diego, asi hay que enfrentar a la gente con la verdad.",hace 11 meses,0
https://www.youtube.com/watch?v=YvvPeimqLQI,@alitivo.a,¡Cara dura!,hace 3 años,0
https://www.youtube.com/watch?v=YvvPeimqLQI,@anadelcarmenmelchor7569,"Gracias señor Juan Diego,  también usted se mamo ya de tanto engaño, de tanto atraco a los Colombianos, de tanta podredumbre que hay en ciertos grupos políticos, ? Usted como periodista si que debe saber verdades sobre los entramados que se hacen para arrebatarnos lo que es nuestro. Así es que lo necesitamos apoyando para que cese tanta injusticia en contra de los que no tenemos voz ni mando. Gracias hoy te siento hermano.",hace 3 años,0
https://www.youtube.com/watch?v=YvvPeimqLQI,@JohnS-d7v,"Diego Alvira excelente periodista,sin tapujos.",hace 1 año,0
