video_url,author,text,time,votes
https://www.youtube.com/watch?v=IFd9u69HxeU,@alacenacelular4488,Que responda y pague como cualquier otra infractora  no debe de haber cuello para nadie que responda,hace 4 años,0
https://www.youtube.com/watch?v=IFd9u69HxeU,@diegoisazahoyos6472,"No se necesita una lupa para ver el torcido: Los que  respaldan a la Ministra: Duque, el Centro Democrático, la familia Barranquillera, y  los corruptos de Bogotá, ¡INCREIBLE!!! Felicitaciones Representante Miranda. Cuente con mi voto para el año entrante,l",hace 4 años,10
https://www.youtube.com/watch?v=IFd9u69HxeU,@matildesuarez1708,Hay que cambiar esta situación..no mas centro democrático...,hace 4 años,6
https://www.youtube.com/watch?v=IFd9u69HxeU,@rafareds7010,Felicitaciones a Caracol con esta investigación y con la congresistas invitada,hace 4 años,4
https://www.youtube.com/watch?v=IFd9u69HxeU,@miguelgutierrez6445,Se deberían acabar esas tales uniones temporales q sean empresas sólidas y q puedan dar respaldo a los contratos,hace 4 años,0
https://www.youtube.com/watch?v=IFd9u69HxeU,@amayanimemaniatico,"Que pena,  deberían de quitarle todas las propiedades y dejarlos por el piso.",hace 4 años,0
https://www.youtube.com/watch?v=IFd9u69HxeU,@yamithiago5053,Creo que ya no podían ocultar más esta vaina jajaja,hace 4 años,3
https://www.youtube.com/watch?v=IFd9u69HxeU,@josepicomedina9892,"Los de caracol se hacen los que destapan para que digan que son imparciales , pero en realidad son los mismos.",hace 4 años,2
https://www.youtube.com/watch?v=IFd9u69HxeU,@omarardila383,Muy raro,hace 4 años,0
https://www.youtube.com/watch?v=IFd9u69HxeU,@Carlos-ep1si,"Son estrategias, ellos saben que están en la mira de la sociedad.",hace 4 años,2
https://www.youtube.com/watch?v=IFd9u69HxeU,@juniorttorradocastro2993,La ministra se tiene que ir para la cárcel mínimo unos 20 años  con todos esos contratistas  para que afinen !!!!,hace 4 años,2
https://www.youtube.com/watch?v=IFd9u69HxeU,@juniorttorradocastro2993,Venga y como para cuando van a destapar lo que hacen con la plata las eps ????,hace 4 años,0
https://www.youtube.com/watch?v=IFd9u69HxeU,@juniorttorradocastro2993,Para que  hpts sirve la tal contraloría y la procudaduria ????,hace 4 años,0
https://www.youtube.com/watch?v=IFd9u69HxeU,@alx0243, @JuanSMartinez  menos mal que no nos convertimos en venezuela,hace 4 años,0
https://www.youtube.com/watch?v=IFd9u69HxeU,@CodiCrow,Porque quieren poner a uno de los dueños de este canal.,hace 4 años,2
https://www.youtube.com/watch?v=IFd9u69HxeU,@danieltorrente8379,Pensamos igual.... Invreible pero cierto,hace 4 años,0
https://www.youtube.com/watch?v=IFd9u69HxeU,@lilymoreno6254,Caracol que felicidad. De saber que no tapen estas noticias,hace 2 años,0
https://www.youtube.com/watch?v=IFd9u69HxeU,@yuliethlicedbermudeztorres5713,Esto para el cuota de cambio radical no es la primer vez que hacen algo así... Miren ese ministerio cuota de que partido es ....,hace 4 años,0
https://www.youtube.com/watch?v=IFd9u69HxeU,@the.jackal83,siga creyenbdo que los elefantes vuelan y son rosados. Todo esto está orquestado.,hace 4 años,0
https://www.youtube.com/watch?v=IFd9u69HxeU,@maryluzhenriquezvillareal1409,"SEPALO SRA LA.MINISTRA NO ES DEL CENTRO DEMOCRATICO, PERTENECE AL PARTIDO CAMBIO RADICAL ENTERESEEE",hace 4 años,0
https://www.youtube.com/watch?v=IFd9u69HxeU,@patriciarivera2337,"Y uno que se siente ladrón cuando no tienen para el trasmilenio y le pide a alguien que si lo deja pasar con el que si pago ,hágame el favor",hace 4 años,8
https://www.youtube.com/watch?v=IFd9u69HxeU,@negocios4944,"Comcel uno de los mejores operadores en Colombia, un poquito costosos sus servicios pero vale la pena pagar por ello",hace 4 años,4
https://www.youtube.com/watch?v=IFd9u69HxeU,@diegodiego5489,Hay si no la persiguen y señalan a la personaje esta pero a los de la primera linea si que los capturaron a toda costa,hace 4 años,8
https://www.youtube.com/watch?v=IFd9u69HxeU,@archivosecreto5253,"Este delito y el homicidio deberían ser considerados los mas graves en el pais.
Y recibir la condena mas severa posible.
Solo así saldremos de la miseria.",hace 4 años,0
https://www.youtube.com/watch?v=IFd9u69HxeU,@carlosandresbernal2270,"POR QUE NO NOMBRARON A LOS CHAR,??
AHH POR QUE ANUNCIAN EN CARACOL ....SUPERTIENDAS OLIMPICA!!",hace 4 años,7
https://www.youtube.com/watch?v=IFd9u69HxeU,@diznardacontreras5834,Cárcel para todos los corruptos,hace 4 años,0
https://www.youtube.com/watch?v=IFd9u69HxeU,@patyusma1831,Vaya y sea un contratico pinche en una alcaldia de bajo presupuesto y ahí si los jueces van con todo el peso de la ley.  Pero como son los ministros ahí sino hay ley.,hace 4 años (editado),0
https://www.youtube.com/watch?v=IFd9u69HxeU,@albasanchez8881,🙏🙇‍♀️👌👍🇨🇴🇬🇧🌟🌟🌟🌟🌟Bdciones así va cayendo 👍,hace 4 años,0
https://www.youtube.com/watch?v=IFd9u69HxeU,@alvaroparra859,Abudinar igual robar y estafar,hace 4 años,1
https://www.youtube.com/watch?v=IFd9u69HxeU,@piedadborboez8409,Allí no hacen nada los famosos jueces... allí los que destapan estás ollas son los periodistas,hace 4 años,0
https://www.youtube.com/watch?v=IFd9u69HxeU,@blancagladyscuervo1624,"Si todos estos despreciables políticos no robaran Colombia sería rico, no habrían elefantes blancos , había muy buena educación , carreteras excelentes etc, etc, es que tristeza 😰😭 con todo este escándalo y ahí está , no conocen la dignidad, honradez , solo
 Obtener dinero a como dé lugar y como sea 😰😰, el pueblo les importe un rábano",hace 4 años,0
https://www.youtube.com/watch?v=IFd9u69HxeU,@josealfredohernandezsalas1278,"Mientras no hayan penas ejemplares, mientras las con secuencias no sean fuertes para los implicados en estos desfalcos  a la  nación, el erario público será un botín apetecible para los corruptos.",hace 4 años,0
https://www.youtube.com/watch?v=IFd9u69HxeU,@pitmusic428,INCREIBLE!!! Y ESTA SEÑORA MINISTRA ANDA LIBRE,hace 4 años,1
https://www.youtube.com/watch?v=IFd9u69HxeU,@hellasoy6684,este no debe ser el.unico contrato corruto debe ser muchos mas con dependencias o subdepencias o contratistas del estado y los demas ministerios que son mas 12 y las innumerables entidades del estado,hace 4 años,1
https://www.youtube.com/watch?v=IFd9u69HxeU,@jamescastro7783,Q pesar este pais en manos de estos corruptos,hace 4 años,0
https://www.youtube.com/watch?v=IFd9u69HxeU,@oscarwolf8052,"Pena de muerte a políticos ladrones como en china, fuera renuncien lárguense, ya está bueno del cuento de que fue a mis espalda, tú eres el capitán de tu barco y eliges tus marinos, si hacen mal su trabajo tu como capitán respondes tengas o no la culpa, pero son tan sinverguenzas que se quedan en el puesto, y el pais que se lo permite",hace 4 años (editado),0
https://www.youtube.com/watch?v=IFd9u69HxeU,@carloscancino2151,No estaba preparada para ese ministerio,hace 4 años,0
https://www.youtube.com/watch?v=IFd9u69HxeU,@JesusRODRIGUEZ-lv4vo,"Pero no es una parte del dinero, sino es todo el dinero en su totalidad, por que los colombianos, no podemos seguir perdiendo, por culpa de los corruptos,  gracias CARACOL, por investigar.",hace 4 años,0
https://www.youtube.com/watch?v=IFd9u69HxeU,@AngelaSilva-mj4ev,"Que dejenerados, y corrompidos,  a esos  si hay que meterles toda la poquita ley que hay, para los que roban, el estado Colombiano,
Esa plata es del pueblo,",hace 4 años,0
https://www.youtube.com/watch?v=IFd9u69HxeU,@walterleal6758,"Y lo peor es que el gobierno tiene en el escritorio una reforma tributaria.
......",hace 4 años,0
https://www.youtube.com/watch?v=IFd9u69HxeU,@alfonsogamboa9527,Deben quitarle todos esos contratos a esas empresas y la ministro y los de esas empresas deben ir presos,hace 4 años,0
https://www.youtube.com/watch?v=IFd9u69HxeU,@josejimenez6889,Juan Didgo.Desmascare y digale la verda a esos Corructos.,hace 4 años,0
https://www.youtube.com/watch?v=IFd9u69HxeU,@alejandraramirezpalacios285,"Que descaro el de la ministra, que macabro juego, que falta de corazón y de amor por su país, que vergüenza; como siempre pasa con todos los políticos, dándole el beneficio de los contratos a quien más le beneficie a ella.
Hasta cuando va a ganar la avaricia y la codicia sobre el bienestar de toda una sociedad que lo único que quiere es educarse para surgir medianamente en un país de escasas oportunidades. La cárcel le queda poquita para lo que merece esta señora.",hace 4 años,1
https://www.youtube.com/watch?v=IFd9u69HxeU,@gzart9357,No demora en escaparse... Todos untados y prestados,hace 4 años,0
https://www.youtube.com/watch?v=IFd9u69HxeU,@luiscarmona6145,Esa es de la misma red de contratación de Odebrecht y cómo siempre pagan los que llenos les toca,hace 4 años,0
https://www.youtube.com/watch?v=IFd9u69HxeU,@luishoyos6424,Es una vaina absurda 😁😁😁,hace 4 años,0
https://www.youtube.com/watch?v=IFd9u69HxeU,@sarayuliethbocanegragonzal3407,"Señor........"" hasta   cuando,  hasta cuando........"" hasta cuando  nos ban ha  seguir  robando""",hace 4 años,0
https://www.youtube.com/watch?v=IFd9u69HxeU,@orlandocamargodiaz3743,Ahora si comprendo por.que la vía de Cisneros Antioquia que comunica con Santander esta ran deteriorado.  Cualquier accidente será oneroso para la.nacion,hace 4 años,0
https://www.youtube.com/watch?v=IFd9u69HxeU,@dianasierra7601,Los politicos  viven dela pobresa  y nosotros no deberíamos de botar pordadien,hace 4 años,0
https://www.youtube.com/watch?v=IFd9u69HxeU,@leocerquera,Deberían poner la corrupción como pena de muerte,hace 4 años,0
https://www.youtube.com/watch?v=IFd9u69HxeU,@fabianrivera34,Gracias CD 👏🏼👏🏼👏🏼👏🏼👏🏼👏🏼👏🏼👏🏼👏🏼👏🏼👏🏼👏🏼👏🏼👏🏼,hace 4 años (editado),1
https://www.youtube.com/watch?v=IFd9u69HxeU,@jaimecujavante1598,Los ladrones de hoy en día ya no son enmascarados si no encorbatados!!!!,hace 4 años,0
https://www.youtube.com/watch?v=IFd9u69HxeU,@jairorodriguez4474,MALDITA CORRUPCIÓN y los únicos responsables somos nosotros por elegir siempre el  mismo sistema,hace 4 años,0
https://www.youtube.com/watch?v=IFd9u69HxeU,@janethdaza5012,"No cumplió simplemente pasó lo que siempre pasa en este País, se robaron el dinero ,se lo repartieron entre todos  y no puedo creer como no está en la cárcel .",hace 3 años,0
https://www.youtube.com/watch?v=IFd9u69HxeU,@juanfernandohernandez2931,"Es solo la punta del Iceberg, no quisiera ni pensar el resto.",hace 4 años,0
https://www.youtube.com/watch?v=IFd9u69HxeU,@albertogarciarangel8767,"Esto no puede seguir pasando en Colombia esto si requiere la Cadena Perpetua en Cárcel,  esto como todos los robos que han habido ya terminará pérdida",hace 4 años,0
https://www.youtube.com/watch?v=IFd9u69HxeU,@davidsalguedo4259,Y no pasara nada en este país de joyas,hace 4 años,0
https://www.youtube.com/watch?v=IFd9u69HxeU,@anuboslars7808,"Gobernantes, ""empresarios"", personas.... todos debemos CAMBIAR......... el ejemplo empieza por casa.... no esperemos que cambien las cosas si seguimos votando por los mismos y dándonos de ""vivos"" en nuestras vidas cotidianas",hace 4 años,0
https://www.youtube.com/watch?v=IFd9u69HxeU,@romardu8587,"Ésto es lo que se les pide a los medios, nada de ocultar. Hay que difundir la corrupción, con ése simple acto se deja de ser cómplice de esos criminales, destapando todas sus ollas podridas",hace 4 años,0
https://www.youtube.com/watch?v=IFd9u69HxeU,@contadoresmipymes9931,Averiguen muy bien eso señores,hace 4 años,0
https://www.youtube.com/watch?v=IFd9u69HxeU,@liliaizquierdo50,Si mi tío ojalá que reformen la ley para que no se roben los recursos,hace 3 años,0
https://www.youtube.com/watch?v=IFd9u69HxeU,@angelabonilla505,Hasta que por fín están informado a los colombianos. Un 100 por información como estas al país. Sigan así y estarán en la cima del noticiero más visto en colombia,hace 3 años,1
https://www.youtube.com/watch?v=IFd9u69HxeU,@rogertorres7356,"2 billoncitos de pesos eso es basura, se pierden y no pasa nada🤷🏾‍♂️ rompen una ventana y 10 años de cárcel 🤦🏾‍♂️ este es mi país",hace 4 años,0
https://www.youtube.com/watch?v=IFd9u69HxeU,@jhonyalexanderosunarivera4700,Acá debería ser como en China alos corruptos les dan pena de. Muerte,hace 4 años,0
https://www.youtube.com/watch?v=IFd9u69HxeU,@emailsuarez7845,"Asi pongan a alguien del pueblo en ese cargo ""igual se roba la plata y deja viendo un chispero a todos"" en este país nos falta cultura valores ser buenas personas la culpa no es de uno si no de todos",hace 4 años,0
https://www.youtube.com/watch?v=IFd9u69HxeU,@jhontovar9182,"Y yo  trabajando todo un mes por un salario mínimo, que no alcanza sino para pagar arriendo, servicios, transporte, y medio alimentación, mientras estos vagos derechistas envolatan 70.000 millones no jodaaa",hace 4 años,1
https://www.youtube.com/watch?v=IFd9u69HxeU,@jhonalexandersson,En Colombia ya deben aplicar la ley del Samurai. Ya es hora.,hace 4 años,0
https://www.youtube.com/watch?v=IFd9u69HxeU,@JorgeSanchez-ge3wm,Que entre el DIABLO y escoja y saldria corriendo,hace 4 años,1
https://www.youtube.com/watch?v=IFd9u69HxeU,@alexanderarango9970,Que lindo… ese es mi país🙄….,hace 4 años,1
https://www.youtube.com/watch?v=IFd9u69HxeU,@mauricioantoniocamachoromero,Huy Echeverry...!como que nos tumbaron...!😳🐀🐁🐁🐀🐀🐀🐀,hace 4 años,0
https://www.youtube.com/watch?v=IFd9u69HxeU,@marcelabaron12,"Que tristeza 😔, saber que ni en las calles, ni en el gobierno hay seguridad. En ningún lado de este país estamos seguros.",hace 4 años,0
https://www.youtube.com/watch?v=IFd9u69HxeU,@kikke4636,"Cuando se habla de millones de millones las ratas se alborotan y el bienestar de los colombianos queda en un quinto plano, hay que cambiar todo esto comenzando desde los hogares cambiar la cultura de la vivesa Por la honestidad",hace 4 años,0
https://www.youtube.com/watch?v=IFd9u69HxeU,@shirairyu2141,"Pero vaya alguien que no tenga para comer a robarse algo y verá que hay si le cae todo el ""peso de la ley""",hace 4 años,0
https://www.youtube.com/watch?v=IFd9u69HxeU,@gokush8611,Vergüenza nacional!,hace 4 años,0
https://www.youtube.com/watch?v=IFd9u69HxeU,@rosamariacorrea3747,Esto es muy importante..que haya otra persona...que entienda lo que hace la otra...pero hasta cuándo tanta trampas y engaños.. quien será justo en esta COSAS.roben y roben y roben..quien será claro.y correcto....,hace 4 años,0
https://www.youtube.com/watch?v=IFd9u69HxeU,@yorkydejesusvergaraconde2939,Que tristeza en este país todo lo de nosotros los pobres se lo roban los de cuello blanco,hace 4 años,0
https://www.youtube.com/watch?v=IFd9u69HxeU,@edwardwillianperdomoizasa7611,Todos los que roban y mienten gritan por que la culpabilidad los desespera y entran en pánico!,hace 4 años (editado),0
https://www.youtube.com/watch?v=IFd9u69HxeU,@basic_npc9180,"ojala se pongan las pilas y le sigan el rastro a esos estafadores, aqui se les cayo un negocio pero deben de tener más por ay más chanchullos escondidos",hace 4 años,0
https://www.youtube.com/watch?v=IFd9u69HxeU,@carloszamora5368,"Cárcel física, no casa x cárcel.",hace 3 años,0
https://www.youtube.com/watch?v=IFd9u69HxeU,@joseleoneltorresrodriguez4528,La corrupción termina en nuestro país cuando nosotros entendamos que no podemos seguir votando por los mismos corruptos de siempre,hace 4 años,0
https://www.youtube.com/watch?v=IFd9u69HxeU,@mercedesvillarreal4348,Qué le caiga todo el peso de la Ley Divina.,hace 3 años,0
https://www.youtube.com/watch?v=IFd9u69HxeU,@Carlos-ep1si,"Hasta donde hemos llegado, ni siquiera los niños de estratos bajos, una población tan vulnerable, se salvan de la corrupción de estos personajes, que deshonestos y miserables.",hace 4 años (editado),0
https://www.youtube.com/watch?v=IFd9u69HxeU,@patriciamera7883,"Que bellezasssssssss cadena perpetua para estos también, y que les quiten todo lo que han comprado con plata ajena.....",hace 4 años,0
https://www.youtube.com/watch?v=IFd9u69HxeU,@mariaruthcastellanosbernal9205,"La culpa no es de ellos, la culpa es de los ciudadanos de a pie q estan enamorados de esos corruptos y año tras año los vuelven a elegir.¿ Que les pasa? Despierten ya y dejen de defender a todos esos corruptos lo q nos debe importar es los interese del pueblo no los de los corruptos.",hace 4 años,0
https://www.youtube.com/watch?v=IFd9u69HxeU,@consuelomoraquinonez3686,Qué vergüenza llegan a llenar carteras,hace 4 años,0
https://www.youtube.com/watch?v=IFd9u69HxeU,@greysofiaenciso4207,Que estafa tan grande de las erratas esas pura porquería  los llamado gente de bien,hace 4 años,0
https://www.youtube.com/watch?v=IFd9u69HxeU,@josereina5087,Esa ladrona tiene q pagar con cárcel no en casa por cárcel y q devuelva todo,hace 4 años,0
https://www.youtube.com/watch?v=IFd9u69HxeU,@luiseduardotorresclavijo2960,Recursos públicos sagrados desangrados. Y no pasa nada.,hace 4 años,0
https://www.youtube.com/watch?v=IFd9u69HxeU,@brayansucre7561,Y mientras tanto los niños esperando su internet muchos de bajos recursos que indolencia la de esos personajes,hace 4 años,0
https://www.youtube.com/watch?v=IFd9u69HxeU,@davidsantiagopalaciovalenc520,Lo más triste es que seguirá todo igual.,hace 4 años,0
https://www.youtube.com/watch?v=IFd9u69HxeU,@brayanvelandia4938,"La corrupción aflora en este país por la puta burocracia han grande que hay, una licitación hasta para ir al baño",hace 4 años,0
https://www.youtube.com/watch?v=IFd9u69HxeU,@danielcastaneda8309,Esto es Colombia hoy y siempre,hace 4 años,0
https://www.youtube.com/watch?v=IFd9u69HxeU,@martharodriguez9311,"Un servidor Público que administra recursos públicos, le abre la puerta al peculado cuando a través de la contratación pública, viola los principios de la Contratación Estatal y violar los principios también es delito y conlleva falsedades, tráfico de influencias, concursos de delitos, concierto para delinquir, etc",hace 4 años,0
https://www.youtube.com/watch?v=IFd9u69HxeU,@fers24,"Con los términos de las licitaciones, que por supuesto son manipulados desde el principio para eliminar posibles competidores básicamente por requisitos económicos y financieros, ""no pueden"" filtrar ni las empresas que han desangrado ya antes el erario ni los criminales que en ellas se esconden, pero si ponen por ejemplo, unos superrequisitos en los perfiles de los profesionales, sobretodo a los ingenieros, despreciando y desperdiciando la experiencia para ahorrarse miserablemente unos pesos con malos salarios para ingenieros con títulos pero sin experiencia en muchos casos.",hace 4 años,0
https://www.youtube.com/watch?v=IFd9u69HxeU,@vanalfram2370,Que esperan el congreso y altas cortes,hace 4 años,0
https://www.youtube.com/watch?v=IFd9u69HxeU,@hectorgarces2366,Les queda más fácil hacer la presentación en Power Point,hace 4 años,0
https://www.youtube.com/watch?v=IFd9u69HxeU,@wilsonmontanorodriguez7639,Eso no es raro acá en Colombia ya se envolataron esa plata las ratas y como siempre nada va a pasar y mínimo le tendrán ya preparado un Ministerio o una Alcaldía para premiarla porque que más...Gobierno agachado y cómplice,hace 4 años,0
https://www.youtube.com/watch?v=IFd9u69HxeU,@luzdiaz4560,Lo que deben hacer es meterla  ala cárcel  se roban los dineros de todo y no pasa nada,hace 4 años,0
https://www.youtube.com/watch?v=IFd9u69HxeU,@transformers2293,"En Colombia pasan cosas increíbles pero siempre y cuando tenga que ver con corruptos y corrupción no pasa nada..... éste es mi país desgraciadamente, y presten ATENCIÓN platica de la EDUCACIÓN. Por eso estamos como estamos.",hace 4 años (editado),0
https://www.youtube.com/watch?v=IFd9u69HxeU,@juanlesmes419,"Le mintió al país, las cosas como son , atraco el país .",hace 4 años,0
https://www.youtube.com/watch?v=IFd9u69HxeU,@juaquintabares776,"Que pague el partido político ,",hace 4 años,0
https://www.youtube.com/watch?v=IFd9u69HxeU,@leonardofierro2420,que por favor la ministra cumpla su palabra y la lleven al cementerio...jejeje,hace 4 años,0
https://www.youtube.com/watch?v=IFd9u69HxeU,@federicofedweixo1336,"Cómo!!!!!  Parte de los adjudicatarios, era asesor directo de la bandida principal...no lo puedo creer,   ojalá yo haya entendido mal. Porque si esa mujer no está en la cárcel, deben abrir las puertas de las mismas cárceles y que salgan todos los que estén presos por actos de corrupción.",hace 4 años,0
https://www.youtube.com/watch?v=IFd9u69HxeU,@augustodoradobarahona3913,como cambia el significado de las palabras ahora robar significa mentir...72000 000 000,hace 4 años,0
https://www.youtube.com/watch?v=IFd9u69HxeU,@fernandobarahona8500,"En pocas palabras la ministra no sabía a donde estaba parada, Pero tiene que estar en la jugada",hace 4 años,0
https://www.youtube.com/watch?v=IFd9u69HxeU,@josedanilogomezescobar6387,Pena de muerte para los corruptos; se debe aprobar en Colombia.  Estamos demorados,hace 4 años,0
https://www.youtube.com/watch?v=IFd9u69HxeU,@luffyzorrosanji,Siguen robando los políticos costeños,hace 4 años,0
https://www.youtube.com/watch?v=IFd9u69HxeU,@jeicolatorre6234,Esos son los q se eligen por un tamal,hace 4 años,0
https://www.youtube.com/watch?v=IFd9u69HxeU,@mauricioalzatemunoz4050,Qué Vaina con la Corrupción,hace 4 años,0
https://www.youtube.com/watch?v=IFd9u69HxeU,@fernandojmozo,Y ahora que va a pasar... la misma impunidad de siempre?,hace 4 años,0
https://www.youtube.com/watch?v=IFd9u69HxeU,@alfonsoesquivel7554,Eso es igual o peor que agroingreso inseguro 🤔🤔🤔,hace 4 años,0
https://www.youtube.com/watch?v=IFd9u69HxeU,@gustavobolanos325,Se perdió la plática Mela mecatie en cositas que tristeza 😢,hace 4 años,1
https://www.youtube.com/watch?v=IFd9u69HxeU,@johanser9476,Lo mas chistoso es que pareciera que todos esos políticos que tienen fotos con el honorable ganadero ñeñe Hernández (como es el caso de Karen Abudinen- ministra de las TIC) se llenaran de desgracia y tragedias familiares ajajajja,hace 4 años (editado),0
https://www.youtube.com/watch?v=IFd9u69HxeU,@juliogarcia9039,5 años de casa de cárcel para algunos y luego a disfrutar esa platica.,hace 4 años,0
https://www.youtube.com/watch?v=IFd9u69HxeU,@elkindariomejiavalencia6519,"Cadena perpetua para los corruptos, pero no en sus casas. En la modelo y el buen pastor",hace 4 años,0
https://www.youtube.com/watch?v=IFd9u69HxeU,@Xeiber1931,Les fueran dado esa plata a los Wisp Colombianos y ya hubiera Internet en todo el país.,hace 4 años,0
https://www.youtube.com/watch?v=IFd9u69HxeU,@felipevelez5296,"Jajaja yo sabía que es promesa que hizo, era literal... directo a la tumba 🤣🤣🤣",hace 3 años,0
https://www.youtube.com/watch?v=IFd9u69HxeU,@ryubasha,"Oh que sorpresa, un político que miente... Nunca espere algo así 😂
Lo raro sería que no mientan o no roben",hace 4 años,1
https://www.youtube.com/watch?v=IFd9u69HxeU,@delcymariateheranmelendez6322,Colombia tiene muchos cotudos con  papera,hace 4 años,0
https://www.youtube.com/watch?v=IFd9u69HxeU,@gloriacano7402,La persona que se robó un caldo nor para hacer un caldo lo metieron ala cárcel por dos años y esa caren. no le dan cárcel mucho a robado al país el carrusel de la maldad caren,hace 3 años,0
https://www.youtube.com/watch?v=IFd9u69HxeU,@sanmonik05,"No entiendo la Justicia  en nuestro País, envían a cárcel a un señor por roñarse una pasta Maggi y estos am pones de cuello blanco quedan impunes😡💔",hace 4 años,0
https://www.youtube.com/watch?v=IFd9u69HxeU,@jaimeurrea5874,Esto es concierto ( tipo woodstock) para delinquir.,hace 4 años,0
https://www.youtube.com/watch?v=IFd9u69HxeU,@JoseHernandez-lt4qt,El billete lo guardaron en una gorra de beisbolista??? Parece que si!!!,hace 4 años,0
https://www.youtube.com/watch?v=IFd9u69HxeU,@andresjuradomunoz1974,Excelente Katherine.,hace 4 años,0
https://www.youtube.com/watch?v=IFd9u69HxeU,@Andresriav,Más políticos como Katherine Miranda¡ por favor miren esa moción de censura que vergüenza¡¡¡ no voten por los corruptos que no acudieron y apoyan a la ministra,hace 4 años,0
https://www.youtube.com/watch?v=IFd9u69HxeU,@armandovergara2682,éso es para q tengamos en cuenta por quién beamos a votar en las elecciones  presidenciales,hace 4 años,0
https://www.youtube.com/watch?v=IFd9u69HxeU,@julietaobando1719,Responsabilidad política y administrativa,hace 4 años,0
https://www.youtube.com/watch?v=IFd9u69HxeU,@franc7754,"Pero cual es el seguimiento del estado a la contratación pública, porque alguien ligado al carrusel de la contratación puede participar en licitaciones públicas?????",hace 4 años,0
https://www.youtube.com/watch?v=IFd9u69HxeU,@DX00000,Corrupción total algo normal en Colombia!,hace 4 años,0
https://www.youtube.com/watch?v=IFd9u69HxeU,@rosariocarrillocelis4913,En qué termina eso estamos pendientes y Mandela para el cementerio como ella lo menciono,hace 3 años,0
https://www.youtube.com/watch?v=IFd9u69HxeU,@yurischigua3475,"Lo mas triste es que Colombia tiene tan normalizado todos estos temas, que ya estamos tan acostumbrados",hace 4 años,0
https://www.youtube.com/watch?v=IFd9u69HxeU,@josericardogonzalezsoto1135,Buena noticia Juan Diego,hace 4 años,0
https://www.youtube.com/watch?v=IFd9u69HxeU,@diobeidaneva8760,Me parece grave corruptos.,hace 4 años,0
https://www.youtube.com/watch?v=IFd9u69HxeU,@jhernandh744,Exelente trabajo caracol,hace 4 años,0
https://www.youtube.com/watch?v=IFd9u69HxeU,@hectormauricioperdomo3063,"Nuestra política es un circo; 
un nido de incompetencia y corrupción extrema.
Que horror, que tristeza!!!!!!!!",hace 4 años,0
https://www.youtube.com/watch?v=IFd9u69HxeU,@luisarboleda2130,"Los contratos, 💲💰🤑👔",hace 4 años,0
